#,"You've been selected to test a new explainable AI (XAI) tool designed for chatbot development, called *DIME*",What is your level of Machine-Learning expertise,"Bot 1️⃣ has a 92.86% validation accuracy.
Bot 2️⃣ has a 85.71% validation accuracy.",Why did you pick that specific bot?,"Now, let's try querying both bots provided to you. 
Type and send ""University එකේ තියෙන ඩිග්‍රීස් මොනවද?"" and check the bot response.","In the query, ""University එකේ තියෙන ඩිග්‍රීස් මොනවද?""
Which word do you think is the most important for the bots to correctly identify it as a DEGREE related question?",Why did you state the selected tokens are important?,"Based on the 1st DIME console, What is the Most Important Word","Based on the 2nd DIME console, What is the Most Important Word","Based on the Explanations & Accuracy, Which model would you choose as the best model?",Why did you pick that model? What drove your decision?,Did DIME Explanations assist you in choosing a better model?,Do you think DIME Explanations are useful when debugging model issues?,Take the Console for a free-ride ⚡,Do you find portable explanation files useful? 💡,Start Date (UTC),Submit Date (UTC),Network ID,Tags
fafjf00m8n5jvjoy65jvd1fafjfqfk41,Let's do this 😎,Intermediate,Bot 1️⃣,because it has higher validation accuracy,Both 1️⃣ & 2️⃣,ඩිග්‍රීස්,because word ඩිග්‍රී is same as degree,University,ඩිග්‍රීස්,"Bot 2️⃣ - Low Acc, Important Feature = ඩිග්‍රීස් ------Console 2️⃣",ඩිග්‍රීස් word is much more related to degrees than university,Yes,Yes,it is an extremely useful tool for chat bot model evaluation,Yes,2022-10-18 17:52:05,2022-10-18 18:04:41,81260d9b89,
rl5w10xiunjk2157qrl5wx9qe2wivv30,Let's do this 😎,Intermediate,Bot 1️⃣,Accuracy is higher,Both 1️⃣ & 2️⃣,ඩිග්‍රීස්,The word selected is directly related to the class,University,ඩිග්‍රීස්,"Bot 2️⃣ - Low Acc, Important Feature = ඩිග්‍රීස් ------Console 2️⃣","Even though accuracy is low, looks like it shows high importance for intuitive words. A small drop in accuracy is fine if the classification task makes sense",Yes,Yes,"Explanation graphs were clear, UI is neat",Yes,2022-10-18 17:42:09,2022-10-18 17:47:37,1d1c699444,
gluyj39b8daiadem3zhvgluyjjnlkktj,Let's do this 😎,Intermediate,Bot 1️⃣,relatively high accuracy,Both 1️⃣ & 2️⃣,ඩිග්‍රීස්,most related to the category selected,University,ඩිග්‍රීස්,"Bot 2️⃣ - Low Acc, Important Feature = ඩිග්‍රීස් ------Console 2️⃣",Accuracy was misleading compared to the explanation provided by DIME,Yes,Yes,UI is feature rich and user friendly with straight forward flow to evaluate models.,Yes,2022-10-18 15:55:51,2022-10-18 16:30:01,f44bafeb71,
ie577zlcslg899z5ie572in4hvl92uuw,Let's do this 😎,,Bot 1️⃣,Because of higher accuracy,Both 1️⃣ & 2️⃣,ඩිග්‍රීස්,it seems more relevant to the intent,University,ඩිග්‍රීස්,"Bot 2️⃣ - Low Acc, Important Feature = ඩිග්‍රීස් ------Console 2️⃣","Although accuracy is low, it is still acceptable in 2nd bot. The 1st bot doesn't seem to look at the correct words",Yes,Yes,Interface is attractive and user friendly,Yes,2022-10-18 15:04:01,2022-10-18 15:06:39,1d1c699444,
jyumratsx3cjyzvk653dc07w4ijyumra,Let's do this 😎,,Bot 1️⃣,Because that bot has a higher validation accuracy,Both 1️⃣ & 2️⃣,ඩිග්‍රීස්,"Since the bot predicted degree as the intent, the selected word seemed the most related",University,ඩිග්‍රීස්,"Bot 2️⃣ - Low Acc, Important Feature = ඩිග්‍රීස් ------Console 2️⃣","Since in the 1st console, the most important word wasn't degree, which shouldn't be the case",Yes,Yes,The UI is very intuitive,Yes,2022-10-18 15:01:35,2022-10-18 15:03:30,1d1c699444,
